{
  "schemaVersion": "dipole.agent.release-manifest.v1",
  "candidateVersion": "agent-runtime@dev",
  "runtimeId": "dipole-agent",
  "stage": "user_gray",
  "components": {
    "model": { "version": "dev", "sha256": "aaaaaaaaaaaaaaaaaaaaaaaaaaaaaaaaaaaaaaaaaaaaaaaaaaaaaaaaaaaaaaaa" },
    "prompt": { "version": "dev", "sha256": "bbbbbbbbbbbbbbbbbbbbbbbbbbbbbbbbbbbbbbbbbbbbbbbbbbbbbbbbbbbbbbbb" },
    "capabilitySchema": { "version": "dev", "sha256": "cccccccccccccccccccccccccccccccccccccccccccccccccccccccccccccccc" },
    "memoryPolicy": { "version": "dev", "sha256": "dddddddddddddddddddddddddddddddddddddddddddddddddddddddddddddddd" }
  },
  "offlineEvalSuiteSha256": "eeeeeeeeeeeeeeeeeeeeeeeeeeeeeeeeeeeeeeeeeeeeeeeeeeeeeeeeeeeeeeee"
}
